{
  "slug": "trending-ad-hook-spotter",
  "category": "plays",
  "tags": [
    "ads"
  ],
  "installation": {
    "base_command": "npx moatt install trending-ad-hook-spotter",
    "supports": [
      "claude",
      "cursor",
      "codex"
    ]
  },
  "requires_skills": [
    "hacker-news-scraper",
    "linkedin-profile-post-scraper",
    "reddit-post-finder",
    "twitter-mention-tracker"
  ]
}
