{
  "slug": "competitor-content-tracker",
  "category": "plays",
  "tags": [
    "competitive-intel"
  ],
  "installation": {
    "base_command": "npx moatt install competitor-content-tracker",
    "supports": [
      "claude",
      "cursor",
      "codex"
    ]
  },
  "requires_skills": [
    "blog-feed-monitor",
    "linkedin-profile-post-scraper",
    "twitter-mention-tracker"
  ]
}
